{
  "campaign": "ATOMIC_IAM_ACCOUNT_ACCESS_REMOVAL",
  "csp": "aws",
  "resources": {
    "attacker_role":    "atomic-iam-account-access-removal-attacker-role",
    "attacker_policy":  "atomic-iam-account-access-removal-attacker-policy",
    "lab_user_1":       "atomic-iam-account-access-removal-lab-user-1",
    "lab_user_2":       "atomic-iam-account-access-removal-lab-user-2",
    "lab_user_1_mfa":   "atomic-iam-account-access-removal-lab-user-1-mfa",
    "lab_group":        "prod-engineers",
    "lab_policy":       "EngineeringReadOnly",
    "trail_name":       "atomic-iam-account-access-removal-trail"
  },
  "pulumi_export_keys": {
    "trail_name":               "trail_name",
    "lab_user_1_name":          "lab_user_1_name",
    "lab_user_2_name":          "lab_user_2_name",
    "lab_group_name":           "lab_group_name",
    "lab_policy_name":          "lab_policy_name",
    "attacker_role_arn":        "attacker_role_arn",
    "lab_user_1_arn":           "lab_user_1_arn",
    "lab_user_2_arn":           "lab_user_2_arn",
    "lab_user_1_access_key_id": "lab_user_1_access_key_id",
    "lab_user_2_access_key_id": "lab_user_2_access_key_id",
    "lab_user_1_mfa_serial":    "lab_user_1_mfa_serial",
    "lab_policy_arn":           "lab_policy_arn",
    "log_bucket_name":          "log_bucket_name"
  }
}
