{
  "campaign": "LUCR-3",
  "csp": "multi",
  "resources": {
    "trail_name":            "lucr3-cloudtrail",
    "saml_provider_name":    "lucr3-okta-saml-idp",
    "federated_role_name":   "lucr3-privileged-federated-role",
    "attacker_iam_user":     "svc-automation-lucr3",
    "honey_iam_user":        "svc-terraform-automation",
    "ec2_ssm_role_name":     "lucr3-ec2-ssm-role",
    "instance_profile_name": "lucr3-instance-profile",
    "attacker_policy_name":  "lucr3-attacker-broad-policy",
    "dynamodb_table":        "lucr3-CustomerRecords",
    "github_repo":           "lucr3-core-platform",
    "secret_prod_db":        "prod/database/master_credentials",
    "secret_stripe":         "prod/payments/stripe_secret_key",
    "secret_honey_creds":    "prod/infrastructure/terraform-automation-key",
    "secret_github_pat":     "prod/cicd/github-actions-token",
    "victim_okta_username":  "victim.employee@lab.internal",
    "sns_topic_name":        "lucr3-canary-alerts",
    "vpc_name":              "lucr3-sandbox-vpc",
    "sg_name":               "lucr3-sg-ec2"
  },
  "pulumi_export_keys": {
    "log_bucket_name":           "log_bucket_name",
    "corporate_bucket_name":     "corporate_bucket_name",
    "engineering_bucket_name":   "engineering_bucket_name",
    "canary_sns_arn":            "canary_sns_arn",
    "saml_provider_arn":         "saml_provider_arn",
    "federated_role_arn":        "federated_role_arn",
    "attacker_iam_user_arn":     "attacker_iam_user_arn",
    "honey_user_arn":            "honey_user_arn",
    "guardduty_detector_id":     "guardduty_detector_id",
    "ec2_instance_id":           "ec2_instance_id",
    "ec2_public_ip":             "ec2_public_ip",
    "subnet_id":                 "subnet_id",
    "ec2_sg_id":                 "ec2_sg_id",
    "vpc_id":                    "vpc_id",
    "azuread_app_client_id":     "azuread_app_client_id",
    "azuread_sp_id":             "azuread_sp_id",
    "secret_prod_db_arn":        "secret_prod_db_arn",
    "secret_stripe_arn":         "secret_stripe_arn",
    "honey_creds_secret_arn":    "honey_creds_secret_arn",
    "github_pat_secret_arn":     "github_pat_secret_arn",
    "dynamodb_table_arn":        "dynamodb_table_arn",
    "cloudtrail_trail_arn":      "cloudtrail_trail_arn",
    "okta_victim_user_id":       "okta_victim_user_id",
    "github_repo_url":           "github_repo_url"
  }
}
