{
  "campaign": "AMBERSQUID",
  "csp": "aws",
  "resources": {
    "cluster_name":        "ambersquid-cluster",
    "trail_name":          "ambersquid-trail",
    "task_family":         "ambersquid-miner",
    "log_group_name":      "/ecs/ambersquid",
    "victim_user_name":    "ambersquid-victim",
    "honey_user_name":     "prod-deploy-svc",
    "codecommit_repo_name":"test",
    "ecs_exec_role_name":  "ambersquid-ecs-execution-role",
    "canary_secret_name":  "prod/database/master_credentials"
  },
  "pulumi_export_keys": {
    "victim_access_key_id":    "victim_access_key_id",
    "victim_secret_access_key":"victim_secret_access_key",
    "honey_access_key_id":     "honey_access_key_id",
    "ecs_cluster_name":        "ecs_cluster_name",
    "task_definition_arn":     "task_definition_arn",
    "cloudtrail_trail_name":   "cloudtrail_trail_name",
    "cloudtrail_bucket_name":  "cloudtrail_bucket_name",
    "tfstate_bucket_name":     "tfstate_bucket_name",
    "canary_secret_arn":       "canary_secret_arn",
    "codecommit_repo_name":    "codecommit_repo_name",
    "subnet_id":               "subnet_id",
    "task_sg_id":              "task_sg_id",
    "cluster_name":            "cluster_name",
    "trail_name":              "trail_name",
    "task_family":             "task_family",
    "log_group_name":          "log_group_name",
    "honey_user_name":         "honey_user_name",
    "canary_secret_name":      "canary_secret_name"
  }
}
